{
  "schema_version": 1,
  "content_type": "ambition",
  "id": "moth-expansion",
  "display_name": "The Debt of the Moth King",
  "start_progress": 8,
  "end_progress": 32,
  "chapters": [
    {
      "id": "path-moth-9",
      "storyId": "path-moth-9",
      "title": "The Addresses Beneath the Lamp",
      "description": "Old Eda brings a bundle of addresses, each struck through in red. The King remembers their occupants as children. Council inspectors call them condemned properties, yet rent is collected every Friday.",
      "location": "court",
      "where": [
        "court"
      ],
      "progress": 8,
      "unlock": {
        "path": "moth",
        "ambition_progress": 8
      },
      "next_storylet": "path-moth-10",
      "choices": [
        {
          "label": "Verify the rent ledgers with Eda",
          "stat": "observation",
          "difficulty": 5,
          "effects": {
            "pathProgress": 1,
            "coin": 2,
            "clues": 0,
            "flag": "moth-witness-8"
          },
          "fail": {
            "sanity": -1,
            "suspicion": 1
          },
          "success": "The first promise was not made to a monarch at all. It was made to families displaced by the new roof. You preserve the evidence for the tenant committee, which changes whose testimony the Council must answer.",
          "failure": "Your effort is noticed before you can finish. A witness hides the evidence for you until you return."
        },
        {
          "label": "Speak to the tenants without revealing the royal seal",
          "stat": "persuasion",
          "difficulty": 5,
          "effects": {
            "pathProgress": 1,
            "coin": 2,
            "clues": 0,
            "relation": {
              "wardens": 2
            },
            "flag": "moth-witness-8-ally"
          },
          "fail": {
            "notoriety": 1,
            "health": -1
          },
          "success": "The first promise was not made to a monarch at all. It was made to families displaced by the new roof. The witness agrees to stand beside you at the hearing; the alliance may cost them their security.",
          "failure": "The witness refuses for now. You learn who must be protected before they will speak."
        },
        {
          "label": "Speak from your past as a keeper of records",
          "stat": "guile",
          "requirement": {
            "background": "scribe"
          },
          "difficulty": 4,
          "effects": {
            "pathProgress": 1,
            "coin": 2,
            "clues": 0,
            "quirks": {
              "ledger": 1
            },
            "relation": {
              "wardens": 1
            },
            "flag": "moth-witness-8-past"
          },
          "fail": {
            "suspicion": 1
          },
          "success": "The first promise was not made to a monarch at all. It was made to families displaced by the new roof. Your own history gives the testimony a meaning nobody else could have supplied.",
          "failure": "Your personal history complicates the interview. The witness asks you to return when their family is safe."
        }
      ]
    },
    {
      "id": "path-moth-10",
      "storyId": "path-moth-10",
      "title": "The Missing Clause",
      "description": "A charter bears twelve clauses in the public edition and thirteen in a version sewn inside a librarian's collar. The thirteenth obliges every household to receive one dependable light.",
      "location": "ink",
      "where": [
        "ink"
      ],
      "progress": 9,
      "unlock": {
        "path": "moth",
        "ambition_progress": 9
      },
      "next_storylet": "path-moth-11",
      "choices": [
        {
          "label": "Read both charters under your lantern",
          "stat": "guile",
          "difficulty": 5,
          "effects": {
            "pathProgress": 1,
            "coin": 2,
            "clues": 1,
            "flag": "moth-witness-9"
          },
          "fail": {
            "sanity": -1,
            "suspicion": 0
          },
          "success": "The Council separated the duty from the payment, then told the Wardens the debt was an act of charity. You preserve the evidence for the tenant committee, which changes whose testimony the Council must answer.",
          "failure": "Your effort is noticed before you can finish. A witness hides the evidence for you until you return."
        },
        {
          "label": "Persuade the librarian to testify",
          "stat": "resolve",
          "difficulty": 5,
          "effects": {
            "pathProgress": 1,
            "coin": 2,
            "clues": 1,
            "relation": {
              "ledger": 2
            },
            "flag": "moth-witness-9-ally"
          },
          "fail": {
            "notoriety": 1,
            "health": 0
          },
          "success": "The Council separated the duty from the payment, then told the Wardens the debt was an act of charity. The witness agrees to stand beside you at the hearing; the alliance may cost them their security.",
          "failure": "The witness refuses for now. You learn who must be protected before they will speak."
        },
        {
          "label": "Speak from your past as a courier",
          "stat": "persuasion",
          "requirement": {
            "background": "runner"
          },
          "difficulty": 4,
          "effects": {
            "pathProgress": 1,
            "coin": 2,
            "clues": 1,
            "quirks": {
              "honest": 1
            },
            "relation": {
              "ledger": 1
            },
            "flag": "moth-witness-9-past"
          },
          "fail": {
            "suspicion": 1
          },
          "success": "The Council separated the duty from the payment, then told the Wardens the debt was an act of charity. Your own history gives the testimony a meaning nobody else could have supplied.",
          "failure": "Your personal history complicates the interview. The witness asks you to return when their family is safe."
        }
      ]
    },
    {
      "id": "path-moth-11",
      "storyId": "path-moth-11",
      "title": "The Foreman's Empty Chair",
      "description": "A second foreman is listed on every Sootworks shift, although nobody remembers meeting him. His wages fund the lamps that keep the royal moths alive.",
      "location": "soot",
      "where": [
        "soot"
      ],
      "progress": 10,
      "unlock": {
        "path": "moth",
        "ambition_progress": 10
      },
      "next_storylet": "path-moth-12",
      "choices": [
        {
          "label": "Trace the forged wages through the accounts",
          "stat": "persuasion",
          "difficulty": 5,
          "effects": {
            "pathProgress": 1,
            "coin": 2,
            "clues": 0,
            "flag": "moth-witness-10"
          },
          "fail": {
            "sanity": -1,
            "suspicion": 0
          },
          "success": "The stolen light is accounted for to the penny. Somebody living still profits from the broken oath. You preserve the evidence for the tenant committee, which changes whose testimony the Council must answer.",
          "failure": "Your effort is noticed before you can finish. A witness hides the evidence for you until you return."
        },
        {
          "label": "Confront the night superintendent",
          "stat": "observation",
          "difficulty": 5,
          "effects": {
            "pathProgress": 1,
            "coin": 2,
            "clues": 0,
            "relation": {
              "hands": 2
            },
            "flag": "moth-witness-10-ally"
          },
          "fail": {
            "notoriety": 1,
            "health": 0
          },
          "success": "The stolen light is accounted for to the penny. Somebody living still profits from the broken oath. The witness agrees to stand beside you at the hearing; the alliance may cost them their security.",
          "failure": "The witness refuses for now. You learn who must be protected before they will speak."
        },
        {
          "label": "Speak from your past as an advocate",
          "stat": "resolve",
          "requirement": {
            "background": "speaker"
          },
          "difficulty": 4,
          "effects": {
            "pathProgress": 1,
            "coin": 2,
            "clues": 0,
            "quirks": {
              "subtle": 1
            },
            "relation": {
              "hands": 1
            },
            "flag": "moth-witness-10-past"
          },
          "fail": {
            "suspicion": 1
          },
          "success": "The stolen light is accounted for to the penny. Somebody living still profits from the broken oath. Your own history gives the testimony a meaning nobody else could have supplied.",
          "failure": "Your personal history complicates the interview. The witness asks you to return when their family is safe."
        }
      ]
    },
    {
      "id": "path-moth-12",
      "storyId": "path-moth-12",
      "title": "Barges of Unpaid Light",
      "description": "Three barges carry glass jars packed in straw. Inside each jar burns a light taken from a house whose occupant was ruled to have never existed.",
      "location": "quays",
      "where": [
        "quays"
      ],
      "progress": 11,
      "unlock": {
        "path": "moth",
        "ambition_progress": 11
      },
      "next_storylet": "path-moth-13",
      "choices": [
        {
          "label": "Slip aboard and identify the consignee",
          "stat": "resolve",
          "difficulty": 5,
          "effects": {
            "pathProgress": 1,
            "coin": 2,
            "clues": 0,
            "flag": "moth-witness-11"
          },
          "fail": {
            "sanity": -1,
            "suspicion": 0
          },